[2025-05-17 16:35:57] 正在初始化模型...
[2025-05-17 16:36:01] 开始处理视频: test1.mp4
[2025-05-17 16:36:03] 进度: 1/181 (0.6%) | FPS: 0.82 | 耗时/帧: 1.220s | YOLO耗时: 0.968s | SAM耗时: 0.000s | 剩余时间: 3.7分钟 | 最新输出: output_frames/frame_0000.png
[2025-05-17 16:36:04] 进度: 6/181 (3.3%) | FPS: 2.54 | 耗时/帧: 0.393s | YOLO耗时: 0.009s | SAM耗时: 0.000s | 剩余时间: 1.1分钟 | 最新输出: output_frames/frame_0005.png
[2025-05-17 16:36:05] 进度: 11/181 (6.1%) | FPS: 3.04 | 耗时/帧: 0.329s | YOLO耗时: 0.009s | SAM耗时: 0.000s | 剩余时间: 0.9分钟 | 最新输出: output_frames/frame_0010.png
[2025-05-17 16:36:06] 进度: 16/181 (8.8%) | FPS: 3.33 | 耗时/帧: 0.300s | YOLO耗时: 0.009s | SAM耗时: 0.000s | 剩余时间: 0.8分钟 | 最新输出: output_frames/frame_0015.png
[2025-05-17 16:36:07] 进度: 21/181 (11.6%) | FPS: 3.53 | 耗时/帧: 0.283s | YOLO耗时: 0.009s | SAM耗时: 0.000s | 剩余时间: 0.8分钟 | 最新输出: output_frames/frame_0020.png
[2025-05-17 16:36:09] 进度: 26/181 (14.4%) | FPS: 3.63 | 耗时/帧: 0.276s | YOLO耗时: 0.009s | SAM耗时: 0.000s | 剩余时间: 0.7分钟 | 最新输出: output_frames/frame_0025.png
[2025-05-17 16:36:10] 进度: 31/181 (17.1%) | FPS: 3.73 | 耗时/帧: 0.268s | YOLO耗时: 0.009s | SAM耗时: 0.000s | 剩余时间: 0.7分钟 | 最新输出: output_frames/frame_0030.png
[2025-05-17 16:36:11] 进度: 36/181 (19.9%) | FPS: 3.78 | 耗时/帧: 0.265s | YOLO耗时: 0.009s | SAM耗时: 0.000s | 剩余时间: 0.6分钟 | 最新输出: output_frames/frame_0035.png
[2025-05-17 16:36:12] 进度: 41/181 (22.7%) | FPS: 3.83 | 耗时/帧: 0.261s | YOLO耗时: 0.009s | SAM耗时: 0.000s | 剩余时间: 0.6分钟 | 最新输出: output_frames/frame_0040.png
[2025-05-17 16:36:13] 进度: 45/181 (24.9%) | FPS: 3.85 | 耗时/帧: 0.260s | YOLO耗时: 0.009s | SAM耗时: 0.000s | 剩余时间: 0.6分钟 | 最新输出: output_frames/frame_0044.png
[2025-05-17 16:36:14] 进度: 50/181 (27.6%) | FPS: 3.92 | 耗时/帧: 0.255s | YOLO耗时: 0.009s | SAM耗时: 0.000s | 剩余时间: 0.6分钟 | 最新输出: output_frames/frame_0049.png
[2025-05-17 16:36:15] 进度: 55/181 (30.4%) | FPS: 3.93 | 耗时/帧: 0.254s | YOLO耗时: 0.009s | SAM耗时: 0.000s | 剩余时间: 0.5分钟 | 最新输出: output_frames/frame_0054.png
[2025-05-17 16:36:17] 进度: 60/181 (33.1%) | FPS: 3.96 | 耗时/帧: 0.252s | YOLO耗时: 0.009s | SAM耗时: 0.000s | 剩余时间: 0.5分钟 | 最新输出: output_frames/frame_0059.png
[2025-05-17 16:36:18] 进度: 65/181 (35.9%) | FPS: 3.98 | 耗时/帧: 0.251s | YOLO耗时: 0.009s | SAM耗时: 0.000s | 剩余时间: 0.5分钟 | 最新输出: output_frames/frame_0064.png
[2025-05-17 16:36:19] 进度: 69/181 (38.1%) | FPS: 3.97 | 耗时/帧: 0.252s | YOLO耗时: 0.009s | SAM耗时: 0.000s | 剩余时间: 0.5分钟 | 最新输出: output_frames/frame_0068.png
[2025-05-17 16:36:20] 进度: 74/181 (40.9%) | FPS: 3.99 | 耗时/帧: 0.251s | YOLO耗时: 0.009s | SAM耗时: 0.000s | 剩余时间: 0.4分钟 | 最新输出: output_frames/frame_0073.png
[2025-05-17 16:36:21] 进度: 78/181 (43.1%) | FPS: 3.98 | 耗时/帧: 0.251s | YOLO耗时: 0.009s | SAM耗时: 0.000s | 剩余时间: 0.4分钟 | 最新输出: output_frames/frame_0077.png
[2025-05-17 16:36:22] 进度: 83/181 (45.9%) | FPS: 3.99 | 耗时/帧: 0.251s | YOLO耗时: 0.009s | SAM耗时: 0.000s | 剩余时间: 0.4分钟 | 最新输出: output_frames/frame_0082.png
[2025-05-17 16:36:24] 进度: 88/181 (48.6%) | FPS: 3.98 | 耗时/帧: 0.251s | YOLO耗时: 0.009s | SAM耗时: 0.000s | 剩余时间: 0.4分钟 | 最新输出: output_frames/frame_0087.png
[2025-05-17 16:36:25] 进度: 93/181 (51.4%) | FPS: 3.99 | 耗时/帧: 0.251s | YOLO耗时: 0.009s | SAM耗时: 0.000s | 剩余时间: 0.4分钟 | 最新输出: output_frames/frame_0092.png
[2025-05-17 16:36:26] 进度: 98/181 (54.1%) | FPS: 4.00 | 耗时/帧: 0.250s | YOLO耗时: 0.009s | SAM耗时: 0.000s | 剩余时间: 0.3分钟 | 最新输出: output_frames/frame_0097.png
[2025-05-17 16:36:27] 进度: 102/181 (56.4%) | FPS: 3.99 | 耗时/帧: 0.251s | YOLO耗时: 0.009s | SAM耗时: 0.000s | 剩余时间: 0.3分钟 | 最新输出: output_frames/frame_0101.png
[2025-05-17 16:36:28] 进度: 107/181 (59.1%) | FPS: 3.99 | 耗时/帧: 0.250s | YOLO耗时: 0.009s | SAM耗时: 0.000s | 剩余时间: 0.3分钟 | 最新输出: output_frames/frame_0106.png
[2025-05-17 16:36:29] 进度: 111/181 (61.3%) | FPS: 3.99 | 耗时/帧: 0.251s | YOLO耗时: 0.009s | SAM耗时: 0.000s | 剩余时间: 0.3分钟 | 最新输出: output_frames/frame_0110.png
[2025-05-17 16:36:30] 进度: 116/181 (64.1%) | FPS: 3.99 | 耗时/帧: 0.251s | YOLO耗时: 0.009s | SAM耗时: 0.000s | 剩余时间: 0.3分钟 | 最新输出: output_frames/frame_0115.png
[2025-05-17 16:36:32] 进度: 121/181 (66.9%) | FPS: 3.99 | 耗时/帧: 0.251s | YOLO耗时: 0.009s | SAM耗时: 0.000s | 剩余时间: 0.3分钟 | 最新输出: output_frames/frame_0120.png
[2025-05-17 16:49:03] 正在初始化模型...
[2025-05-17 16:49:03] YOLOv8模型加载成功
[2025-05-17 16:49:07] TinySAM模型加载成功
[2025-05-17 16:49:07] 开始处理视频: test1.mp4
[2025-05-17 16:49:08] 进度: 1/181 (0.6%) | FPS: 0.80 | 耗时/帧: 1.247s | YOLO耗时: 0.966s | SAM耗时: 0.000s | 剩余时间: 3.7分钟 | 最新输出: output_frames/frame_0000.png
[2025-05-17 16:49:09] 进度: 5/181 (2.8%) | FPS: 2.20 | 耗时/帧: 0.454s | YOLO耗时: 0.009s | SAM耗时: 0.000s | 剩余时间: 1.3分钟 | 最新输出: output_frames/frame_0004.png
[2025-05-17 16:49:10] 进度: 9/181 (5.0%) | FPS: 2.69 | 耗时/帧: 0.371s | YOLO耗时: 0.009s | SAM耗时: 0.000s | 剩余时间: 1.1分钟 | 最新输出: output_frames/frame_0008.png
[2025-05-17 16:49:11] 进度: 13/181 (7.2%) | FPS: 2.90 | 耗时/帧: 0.345s | YOLO耗时: 0.009s | SAM耗时: 0.000s | 剩余时间: 1.0分钟 | 最新输出: output_frames/frame_0012.png
[2025-05-17 16:49:12] 进度: 17/181 (9.4%) | FPS: 3.05 | 耗时/帧: 0.327s | YOLO耗时: 0.009s | SAM耗时: 0.000s | 剩余时间: 0.9分钟 | 最新输出: output_frames/frame_0016.png
[2025-05-17 16:49:13] 进度: 21/181 (11.6%) | FPS: 3.18 | 耗时/帧: 0.314s | YOLO耗时: 0.009s | SAM耗时: 0.000s | 剩余时间: 0.8分钟 | 最新输出: output_frames/frame_0020.png
[2025-05-17 16:49:15] 进度: 25/181 (13.8%) | FPS: 3.24 | 耗时/帧: 0.308s | YOLO耗时: 0.009s | SAM耗时: 0.000s | 剩余时间: 0.8分钟 | 最新输出: output_frames/frame_0024.png
[2025-05-17 16:49:16] 进度: 29/181 (16.0%) | FPS: 3.31 | 耗时/帧: 0.302s | YOLO耗时: 0.009s | SAM耗时: 0.000s | 剩余时间: 0.8分钟 | 最新输出: output_frames/frame_0028.png
[2025-05-17 16:49:17] 进度: 33/181 (18.2%) | FPS: 3.35 | 耗时/帧: 0.299s | YOLO耗时: 0.009s | SAM耗时: 0.000s | 剩余时间: 0.7分钟 | 最新输出: output_frames/frame_0032.png
[2025-05-17 16:49:18] 进度: 37/181 (20.4%) | FPS: 3.39 | 耗时/帧: 0.295s | YOLO耗时: 0.009s | SAM耗时: 0.000s | 剩余时间: 0.7分钟 | 最新输出: output_frames/frame_0036.png
[2025-05-17 16:49:19] 进度: 41/181 (22.7%) | FPS: 3.43 | 耗时/帧: 0.292s | YOLO耗时: 0.009s | SAM耗时: 0.000s | 剩余时间: 0.7分钟 | 最新输出: output_frames/frame_0040.png
[2025-05-17 16:49:20] 进度: 45/181 (24.9%) | FPS: 3.43 | 耗时/帧: 0.291s | YOLO耗时: 0.009s | SAM耗时: 0.000s | 剩余时间: 0.7分钟 | 最新输出: output_frames/frame_0044.png
[2025-05-17 16:49:21] 进度: 50/181 (27.6%) | FPS: 3.49 | 耗时/帧: 0.286s | YOLO耗时: 0.009s | SAM耗时: 0.000s | 剩余时间: 0.6分钟 | 最新输出: output_frames/frame_0049.png
[2025-05-17 16:49:22] 进度: 54/181 (29.8%) | FPS: 3.52 | 耗时/帧: 0.284s | YOLO耗时: 0.009s | SAM耗时: 0.000s | 剩余时间: 0.6分钟 | 最新输出: output_frames/frame_0053.png
[2025-05-17 16:49:23] 进度: 58/181 (32.0%) | FPS: 3.53 | 耗时/帧: 0.284s | YOLO耗时: 0.009s | SAM耗时: 0.000s | 剩余时间: 0.6分钟 | 最新输出: output_frames/frame_0057.png
[2025-05-17 16:49:24] 进度: 62/181 (34.3%) | FPS: 3.54 | 耗时/帧: 0.283s | YOLO耗时: 0.009s | SAM耗时: 0.000s | 剩余时间: 0.6分钟 | 最新输出: output_frames/frame_0061.png
[2025-05-17 16:49:26] 进度: 66/181 (36.5%) | FPS: 3.53 | 耗时/帧: 0.284s | YOLO耗时: 0.009s | SAM耗时: 0.000s | 剩余时间: 0.5分钟 | 最新输出: output_frames/frame_0065.png
[2025-05-17 16:49:27] 进度: 70/181 (38.7%) | FPS: 3.54 | 耗时/帧: 0.283s | YOLO耗时: 0.009s | SAM耗时: 0.000s | 剩余时间: 0.5分钟 | 最新输出: output_frames/frame_0069.png
[2025-05-17 16:49:28] 进度: 74/181 (40.9%) | FPS: 3.55 | 耗时/帧: 0.282s | YOLO耗时: 0.009s | SAM耗时: 0.000s | 剩余时间: 0.5分钟 | 最新输出: output_frames/frame_0073.png
[2025-05-17 16:49:29] 进度: 78/181 (43.1%) | FPS: 3.54 | 耗时/帧: 0.283s | YOLO耗时: 0.009s | SAM耗时: 0.000s | 剩余时间: 0.5分钟 | 最新输出: output_frames/frame_0077.png
[2025-05-17 16:49:30] 进度: 82/181 (45.3%) | FPS: 3.54 | 耗时/帧: 0.282s | YOLO耗时: 0.009s | SAM耗时: 0.000s | 剩余时间: 0.5分钟 | 最新输出: output_frames/frame_0081.png
[2025-05-17 16:49:31] 进度: 86/181 (47.5%) | FPS: 3.55 | 耗时/帧: 0.282s | YOLO耗时: 0.009s | SAM耗时: 0.000s | 剩余时间: 0.4分钟 | 最新输出: output_frames/frame_0085.png
[2025-05-17 16:49:32] 进度: 90/181 (49.7%) | FPS: 3.54 | 耗时/帧: 0.282s | YOLO耗时: 0.009s | SAM耗时: 0.000s | 剩余时间: 0.4分钟 | 最新输出: output_frames/frame_0089.png
[2025-05-17 16:49:33] 进度: 94/181 (51.9%) | FPS: 3.54 | 耗时/帧: 0.282s | YOLO耗时: 0.009s | SAM耗时: 0.000s | 剩余时间: 0.4分钟 | 最新输出: output_frames/frame_0093.png
[2025-05-17 16:49:35] 进度: 98/181 (54.1%) | FPS: 3.55 | 耗时/帧: 0.282s | YOLO耗时: 0.009s | SAM耗时: 0.000s | 剩余时间: 0.4分钟 | 最新输出: output_frames/frame_0097.png
[2025-05-17 16:49:36] 进度: 102/181 (56.4%) | FPS: 3.54 | 耗时/帧: 0.283s | YOLO耗时: 0.009s | SAM耗时: 0.000s | 剩余时间: 0.4分钟 | 最新输出: output_frames/frame_0101.png
[2025-05-17 16:49:37] 进度: 106/181 (58.6%) | FPS: 3.54 | 耗时/帧: 0.283s | YOLO耗时: 0.009s | SAM耗时: 0.000s | 剩余时间: 0.4分钟 | 最新输出: output_frames/frame_0105.png
[2025-05-17 16:49:38] 进度: 110/181 (60.8%) | FPS: 3.53 | 耗时/帧: 0.283s | YOLO耗时: 0.009s | SAM耗时: 0.000s | 剩余时间: 0.3分钟 | 最新输出: output_frames/frame_0109.png
[2025-05-17 16:49:39] 进度: 114/181 (63.0%) | FPS: 3.53 | 耗时/帧: 0.283s | YOLO耗时: 0.009s | SAM耗时: 0.000s | 剩余时间: 0.3分钟 | 最新输出: output_frames/frame_0113.png
[2025-05-17 16:49:40] 进度: 118/181 (65.2%) | FPS: 3.53 | 耗时/帧: 0.283s | YOLO耗时: 0.009s | SAM耗时: 0.000s | 剩余时间: 0.3分钟 | 最新输出: output_frames/frame_0117.png
[2025-05-17 16:49:41] 进度: 122/181 (67.4%) | FPS: 3.53 | 耗时/帧: 0.284s | YOLO耗时: 0.009s | SAM耗时: 0.000s | 剩余时间: 0.3分钟 | 最新输出: output_frames/frame_0121.png
[2025-05-17 16:49:42] TinySAM预测失败: unsupported format string passed to Tensor.__format__
[2025-05-17 16:49:43] 进度: 123/181 (68.0%) | FPS: 3.45 | 耗时/帧: 0.290s | YOLO耗时: 0.010s | SAM耗时: 0.617s | 剩余时间: 0.3分钟 | 最新输出: output_frames/frame_0122.png
[2025-05-17 16:49:44] 进度: 127/181 (70.2%) | FPS: 3.46 | 耗时/帧: 0.289s | YOLO耗时: 0.009s | SAM耗时: 0.000s | 剩余时间: 0.3分钟 | 最新输出: output_frames/frame_0126.png
[2025-05-17 16:49:45] 进度: 131/181 (72.4%) | FPS: 3.46 | 耗时/帧: 0.289s | YOLO耗时: 0.009s | SAM耗时: 0.000s | 剩余时间: 0.2分钟 | 最新输出: output_frames/frame_0130.png
[2025-05-17 16:49:46] TinySAM预测失败: unsupported format string passed to Tensor.__format__
[2025-05-17 16:49:46] 进度: 133/181 (73.5%) | FPS: 3.40 | 耗时/帧: 0.294s | YOLO耗时: 0.010s | SAM耗时: 0.580s | 剩余时间: 0.2分钟 | 最新输出: output_frames/frame_0132.png
[2025-05-17 16:49:47] 进度: 137/181 (75.7%) | FPS: 3.41 | 耗时/帧: 0.293s | YOLO耗时: 0.009s | SAM耗时: 0.000s | 剩余时间: 0.2分钟 | 最新输出: output_frames/frame_0136.png
[2025-05-17 16:49:48] 进度: 141/181 (77.9%) | FPS: 3.42 | 耗时/帧: 0.292s | YOLO耗时: 0.009s | SAM耗时: 0.000s | 剩余时间: 0.2分钟 | 最新输出: output_frames/frame_0140.png
[2025-05-17 16:49:50] TinySAM预测失败: unsupported format string passed to Tensor.__format__
[2025-05-17 16:49:50] 进度: 145/181 (80.1%) | FPS: 3.37 | 耗时/帧: 0.297s | YOLO耗时: 0.010s | SAM耗时: 0.581s | 剩余时间: 0.2分钟 | 最新输出: output_frames/frame_0144.png
[2025-05-17 16:49:51] TinySAM预测失败: unsupported format string passed to Tensor.__format__
[2025-05-17 16:49:52] TinySAM预测失败: unsupported format string passed to Tensor.__format__
[2025-05-17 16:49:52] 进度: 149/181 (82.3%) | FPS: 3.28 | 耗时/帧: 0.305s | YOLO耗时: 0.010s | SAM耗时: 0.590s | 剩余时间: 0.2分钟 | 最新输出: output_frames/frame_0148.png
[2025-05-17 16:49:53] 进度: 153/181 (84.5%) | FPS: 3.29 | 耗时/帧: 0.304s | YOLO耗时: 0.009s | SAM耗时: 0.000s | 剩余时间: 0.1分钟 | 最新输出: output_frames/frame_0152.png
[2025-05-17 16:49:54] 进度: 157/181 (86.7%) | FPS: 3.30 | 耗时/帧: 0.303s | YOLO耗时: 0.009s | SAM耗时: 0.000s | 剩余时间: 0.1分钟 | 最新输出: output_frames/frame_0156.png
[2025-05-17 16:49:56] TinySAM预测失败: unsupported format string passed to Tensor.__format__
[2025-05-17 16:49:56] 进度: 160/181 (88.4%) | FPS: 3.26 | 耗时/帧: 0.307s | YOLO耗时: 0.010s | SAM耗时: 0.598s | 剩余时间: 0.1分钟 | 最新输出: output_frames/frame_0159.png
[2025-05-17 16:49:57] TinySAM预测失败: unsupported format string passed to Tensor.__format__
[2025-05-17 16:49:57] 进度: 162/181 (89.5%) | FPS: 3.22 | 耗时/帧: 0.311s | YOLO耗时: 0.009s | SAM耗时: 0.000s | 剩余时间: 0.1分钟 | 最新输出: output_frames/frame_0161.png
[2025-05-17 16:49:58] TinySAM预测失败: unsupported format string passed to Tensor.__format__
[2025-05-17 16:49:59] 进度: 165/181 (91.2%) | FPS: 3.18 | 耗时/帧: 0.315s | YOLO耗时: 0.010s | SAM耗时: 0.593s | 剩余时间: 0.1分钟 | 最新输出: output_frames/frame_0164.png
[2025-05-17 16:50:00] TinySAM预测失败: unsupported format string passed to Tensor.__format__
[2025-05-17 16:50:01] 进度: 169/181 (93.4%) | FPS: 3.15 | 耗时/帧: 0.318s | YOLO耗时: 0.010s | SAM耗时: 0.617s | 剩余时间: 0.1分钟 | 最新输出: output_frames/frame_0168.png
[2025-05-17 16:50:02] 进度: 173/181 (95.6%) | FPS: 3.16 | 耗时/帧: 0.317s | YOLO耗时: 0.009s | SAM耗时: 0.000s | 剩余时间: 0.0分钟 | 最新输出: output_frames/frame_0172.png
[2025-05-17 16:50:03] 进度: 177/181 (97.8%) | FPS: 3.17 | 耗时/帧: 0.316s | YOLO耗时: 0.009s | SAM耗时: 0.000s | 剩余时间: 0.0分钟 | 最新输出: output_frames/frame_0176.png
[2025-05-17 16:50:04] 
=== 性能总结 ===
结束时间: 2025-05-17 16:50:04
视频文件: test1.mp4
总帧数: 181/181
总时间: 56.76秒 (0.9分钟)
平均FPS: 3.19
平均每帧耗时: 313.60ms
输出目录: /home/huangmanling/TinySAM-main/output_frames

[2025-05-17 16:50:04] 视频分割处理完成!
[2025-05-17 17:03:37] 正在初始化模型...
[2025-05-17 17:03:37] YOLOv8模型加载成功
[2025-05-17 17:03:41] TinySAM模型加载成功
[2025-05-17 17:03:41] 开始处理视频: v1.avi
[2025-05-17 17:03:43] 进度: 1/765 (0.1%) | FPS: 0.53 | 耗时/帧: 1.873s | YOLO耗时: 0.973s | SAM耗时: 0.000s | 剩余时间: 23.9分钟 | 最新输出: output_frames1/frame_0000.png
[2025-05-17 17:03:45] 进度: 3/765 (0.4%) | FPS: 0.83 | 耗时/帧: 1.205s | YOLO耗时: 0.010s | SAM耗时: 0.000s | 剩余时间: 15.3分钟 | 最新输出: output_frames1/frame_0002.png
[2025-05-17 17:03:46] TinySAM预测失败: unsupported format string passed to Tensor.__format__
[2025-05-17 17:03:47] 进度: 5/765 (0.7%) | FPS: 0.79 | 耗时/帧: 1.265s | YOLO耗时: 0.011s | SAM耗时: 0.662s | 剩余时间: 16.0分钟 | 最新输出: output_frames1/frame_0004.png
[2025-05-17 17:03:49] 进度: 7/765 (0.9%) | FPS: 0.87 | 耗时/帧: 1.151s | YOLO耗时: 0.010s | SAM耗时: 0.000s | 剩余时间: 14.5分钟 | 最新输出: output_frames1/frame_0006.png
[2025-05-17 17:03:51] 进度: 9/765 (1.2%) | FPS: 0.92 | 耗时/帧: 1.088s | YOLO耗时: 0.010s | SAM耗时: 0.000s | 剩余时间: 13.7分钟 | 最新输出: output_frames1/frame_0008.png
[2025-05-17 17:03:53] 进度: 11/765 (1.4%) | FPS: 0.95 | 耗时/帧: 1.054s | YOLO耗时: 0.010s | SAM耗时: 0.000s | 剩余时间: 13.3分钟 | 最新输出: output_frames1/frame_0010.png
[2025-05-17 17:03:54] 进度: 13/765 (1.7%) | FPS: 0.98 | 耗时/帧: 1.025s | YOLO耗时: 0.010s | SAM耗时: 0.000s | 剩余时间: 12.8分钟 | 最新输出: output_frames1/frame_0012.png
[2025-05-17 17:03:56] 进度: 15/765 (2.0%) | FPS: 1.00 | 耗时/帧: 1.003s | YOLO耗时: 0.010s | SAM耗时: 0.000s | 剩余时间: 12.5分钟 | 最新输出: output_frames1/frame_0014.png
[2025-05-17 17:03:58] 进度: 17/765 (2.2%) | FPS: 1.01 | 耗时/帧: 0.987s | YOLO耗时: 0.010s | SAM耗时: 0.000s | 剩余时间: 12.3分钟 | 最新输出: output_frames1/frame_0016.png
[2025-05-17 17:03:59] 进度: 19/765 (2.5%) | FPS: 1.03 | 耗时/帧: 0.974s | YOLO耗时: 0.010s | SAM耗时: 0.000s | 剩余时间: 12.1分钟 | 最新输出: output_frames1/frame_0018.png
[2025-05-17 17:04:00] TinySAM预测失败: unsupported format string passed to Tensor.__format__
[2025-05-17 17:04:01] 进度: 20/765 (2.6%) | FPS: 0.98 | 耗时/帧: 1.017s | YOLO耗时: 0.011s | SAM耗时: 0.673s | 剩余时间: 12.6分钟 | 最新输出: output_frames1/frame_0019.png
[2025-05-17 17:04:02] TinySAM预测失败: unsupported format string passed to Tensor.__format__
[2025-05-17 17:04:03] 进度: 21/765 (2.7%) | FPS: 0.95 | 耗时/帧: 1.055s | YOLO耗时: 0.011s | SAM耗时: 0.631s | 剩余时间: 13.1分钟 | 最新输出: output_frames1/frame_0020.png
[2025-05-17 17:04:05] 进度: 23/765 (3.0%) | FPS: 0.96 | 耗时/帧: 1.042s | YOLO耗时: 0.010s | SAM耗时: 0.000s | 剩余时间: 12.9分钟 | 最新输出: output_frames1/frame_0022.png
[2025-05-17 17:04:07] 进度: 25/765 (3.3%) | FPS: 0.97 | 耗时/帧: 1.028s | YOLO耗时: 0.010s | SAM耗时: 0.000s | 剩余时间: 12.7分钟 | 最新输出: output_frames1/frame_0024.png
[2025-05-17 17:04:08] 进度: 27/765 (3.5%) | FPS: 0.98 | 耗时/帧: 1.016s | YOLO耗时: 0.010s | SAM耗时: 0.000s | 剩余时间: 12.5分钟 | 最新输出: output_frames1/frame_0026.png
[2025-05-17 17:04:10] 进度: 29/765 (3.8%) | FPS: 0.99 | 耗时/帧: 1.006s | YOLO耗时: 0.010s | SAM耗时: 0.000s | 剩余时间: 12.3分钟 | 最新输出: output_frames1/frame_0028.png
[2025-05-17 17:04:12] 进度: 31/765 (4.1%) | FPS: 1.00 | 耗时/帧: 0.997s | YOLO耗时: 0.010s | SAM耗时: 0.000s | 剩余时间: 12.2分钟 | 最新输出: output_frames1/frame_0030.png
[2025-05-17 17:04:14] 进度: 33/765 (4.3%) | FPS: 1.01 | 耗时/帧: 0.991s | YOLO耗时: 0.010s | SAM耗时: 0.000s | 剩余时间: 12.1分钟 | 最新输出: output_frames1/frame_0032.png
[2025-05-17 17:04:15] 进度: 35/765 (4.6%) | FPS: 1.02 | 耗时/帧: 0.984s | YOLO耗时: 0.010s | SAM耗时: 0.000s | 剩余时间: 12.0分钟 | 最新输出: output_frames1/frame_0034.png
[2025-05-17 17:04:17] 进度: 37/765 (4.8%) | FPS: 1.02 | 耗时/帧: 0.978s | YOLO耗时: 0.010s | SAM耗时: 0.000s | 剩余时间: 11.9分钟 | 最新输出: output_frames1/frame_0036.png
[2025-05-17 17:04:19] 进度: 39/765 (5.1%) | FPS: 1.03 | 耗时/帧: 0.972s | YOLO耗时: 0.010s | SAM耗时: 0.000s | 剩余时间: 11.8分钟 | 最新输出: output_frames1/frame_0038.png
[2025-05-17 17:04:21] 进度: 41/765 (5.4%) | FPS: 1.03 | 耗时/帧: 0.967s | YOLO耗时: 0.010s | SAM耗时: 0.000s | 剩余时间: 11.7分钟 | 最新输出: output_frames1/frame_0040.png
[2025-05-17 17:04:22] 进度: 43/765 (5.6%) | FPS: 1.04 | 耗时/帧: 0.963s | YOLO耗时: 0.010s | SAM耗时: 0.000s | 剩余时间: 11.6分钟 | 最新输出: output_frames1/frame_0042.png
[2025-05-17 17:04:24] 进度: 45/765 (5.9%) | FPS: 1.04 | 耗时/帧: 0.960s | YOLO耗时: 0.010s | SAM耗时: 0.000s | 剩余时间: 11.5分钟 | 最新输出: output_frames1/frame_0044.png
[2025-05-17 17:04:26] 进度: 47/765 (6.1%) | FPS: 1.05 | 耗时/帧: 0.956s | YOLO耗时: 0.010s | SAM耗时: 0.000s | 剩余时间: 11.4分钟 | 最新输出: output_frames1/frame_0046.png
[2025-05-17 17:04:28] 进度: 49/765 (6.4%) | FPS: 1.05 | 耗时/帧: 0.953s | YOLO耗时: 0.010s | SAM耗时: 0.000s | 剩余时间: 11.4分钟 | 最新输出: output_frames1/frame_0048.png
[2025-05-17 17:04:29] 进度: 51/765 (6.7%) | FPS: 1.05 | 耗时/帧: 0.949s | YOLO耗时: 0.010s | SAM耗时: 0.000s | 剩余时间: 11.3分钟 | 最新输出: output_frames1/frame_0050.png
[2025-05-17 17:04:31] 进度: 53/765 (6.9%) | FPS: 1.06 | 耗时/帧: 0.946s | YOLO耗时: 0.010s | SAM耗时: 0.000s | 剩余时间: 11.2分钟 | 最新输出: output_frames1/frame_0052.png
[2025-05-17 17:04:33] 进度: 55/765 (7.2%) | FPS: 1.06 | 耗时/帧: 0.945s | YOLO耗时: 0.010s | SAM耗时: 0.000s | 剩余时间: 11.2分钟 | 最新输出: output_frames1/frame_0054.png
[2025-05-17 17:04:35] 进度: 57/765 (7.5%) | FPS: 1.06 | 耗时/帧: 0.942s | YOLO耗时: 0.010s | SAM耗时: 0.000s | 剩余时间: 11.1分钟 | 最新输出: output_frames1/frame_0056.png
[2025-05-17 17:04:36] 进度: 59/765 (7.7%) | FPS: 1.06 | 耗时/帧: 0.940s | YOLO耗时: 0.010s | SAM耗时: 0.000s | 剩余时间: 11.1分钟 | 最新输出: output_frames1/frame_0058.png
[2025-05-17 17:04:38] 进度: 61/765 (8.0%) | FPS: 1.07 | 耗时/帧: 0.937s | YOLO耗时: 0.010s | SAM耗时: 0.000s | 剩余时间: 11.0分钟 | 最新输出: output_frames1/frame_0060.png
[2025-05-17 17:04:40] 进度: 63/765 (8.2%) | FPS: 1.07 | 耗时/帧: 0.935s | YOLO耗时: 0.010s | SAM耗时: 0.000s | 剩余时间: 10.9分钟 | 最新输出: output_frames1/frame_0062.png
[2025-05-17 17:04:42] 进度: 65/765 (8.5%) | FPS: 1.07 | 耗时/帧: 0.933s | YOLO耗时: 0.010s | SAM耗时: 0.000s | 剩余时间: 10.9分钟 | 最新输出: output_frames1/frame_0064.png
[2025-05-17 17:04:43] 进度: 67/765 (8.8%) | FPS: 1.07 | 耗时/帧: 0.932s | YOLO耗时: 0.012s | SAM耗时: 0.000s | 剩余时间: 10.8分钟 | 最新输出: output_frames1/frame_0066.png
[2025-05-17 17:04:45] 进度: 69/765 (9.0%) | FPS: 1.07 | 耗时/帧: 0.930s | YOLO耗时: 0.010s | SAM耗时: 0.000s | 剩余时间: 10.8分钟 | 最新输出: output_frames1/frame_0068.png
[2025-05-17 17:04:47] 进度: 71/765 (9.3%) | FPS: 1.08 | 耗时/帧: 0.929s | YOLO耗时: 0.010s | SAM耗时: 0.000s | 剩余时间: 10.7分钟 | 最新输出: output_frames1/frame_0070.png
[2025-05-17 17:04:49] 进度: 73/765 (9.5%) | FPS: 1.08 | 耗时/帧: 0.927s | YOLO耗时: 0.010s | SAM耗时: 0.000s | 剩余时间: 10.7分钟 | 最新输出: output_frames1/frame_0072.png
[2025-05-17 17:04:50] 进度: 75/765 (9.8%) | FPS: 1.08 | 耗时/帧: 0.926s | YOLO耗时: 0.010s | SAM耗时: 0.000s | 剩余时间: 10.6分钟 | 最新输出: output_frames1/frame_0074.png
[2025-05-17 17:04:52] 进度: 77/765 (10.1%) | FPS: 1.08 | 耗时/帧: 0.925s | YOLO耗时: 0.010s | SAM耗时: 0.000s | 剩余时间: 10.6分钟 | 最新输出: output_frames1/frame_0076.png
[2025-05-17 17:04:54] 进度: 79/765 (10.3%) | FPS: 1.08 | 耗时/帧: 0.924s | YOLO耗时: 0.010s | SAM耗时: 0.000s | 剩余时间: 10.6分钟 | 最新输出: output_frames1/frame_0078.png
[2025-05-17 17:04:56] 进度: 81/765 (10.6%) | FPS: 1.08 | 耗时/帧: 0.922s | YOLO耗时: 0.010s | SAM耗时: 0.000s | 剩余时间: 10.5分钟 | 最新输出: output_frames1/frame_0080.png
[2025-05-17 17:04:57] 进度: 83/765 (10.8%) | FPS: 1.09 | 耗时/帧: 0.921s | YOLO耗时: 0.010s | SAM耗时: 0.000s | 剩余时间: 10.5分钟 | 最新输出: output_frames1/frame_0082.png
[2025-05-17 17:04:59] 进度: 85/765 (11.1%) | FPS: 1.09 | 耗时/帧: 0.920s | YOLO耗时: 0.010s | SAM耗时: 0.000s | 剩余时间: 10.4分钟 | 最新输出: output_frames1/frame_0084.png
[2025-05-17 17:05:01] 进度: 87/765 (11.4%) | FPS: 1.09 | 耗时/帧: 0.919s | YOLO耗时: 0.010s | SAM耗时: 0.000s | 剩余时间: 10.4分钟 | 最新输出: output_frames1/frame_0086.png
[2025-05-17 17:05:03] 进度: 89/765 (11.6%) | FPS: 1.09 | 耗时/帧: 0.918s | YOLO耗时: 0.010s | SAM耗时: 0.000s | 剩余时间: 10.3分钟 | 最新输出: output_frames1/frame_0088.png
[2025-05-17 17:05:04] 进度: 91/765 (11.9%) | FPS: 1.09 | 耗时/帧: 0.917s | YOLO耗时: 0.010s | SAM耗时: 0.000s | 剩余时间: 10.3分钟 | 最新输出: output_frames1/frame_0090.png
[2025-05-17 17:05:06] 进度: 93/765 (12.2%) | FPS: 1.09 | 耗时/帧: 0.916s | YOLO耗时: 0.010s | SAM耗时: 0.000s | 剩余时间: 10.3分钟 | 最新输出: output_frames1/frame_0092.png
[2025-05-17 17:05:08] 进度: 95/765 (12.4%) | FPS: 1.09 | 耗时/帧: 0.915s | YOLO耗时: 0.010s | SAM耗时: 0.000s | 剩余时间: 10.2分钟 | 最新输出: output_frames1/frame_0094.png
[2025-05-17 17:05:10] 进度: 97/765 (12.7%) | FPS: 1.09 | 耗时/帧: 0.914s | YOLO耗时: 0.010s | SAM耗时: 0.000s | 剩余时间: 10.2分钟 | 最新输出: output_frames1/frame_0096.png
[2025-05-17 17:05:11] 进度: 99/765 (12.9%) | FPS: 1.09 | 耗时/帧: 0.914s | YOLO耗时: 0.010s | SAM耗时: 0.000s | 剩余时间: 10.1分钟 | 最新输出: output_frames1/frame_0098.png
[2025-05-17 17:05:13] 进度: 101/765 (13.2%) | FPS: 1.10 | 耗时/帧: 0.913s | YOLO耗时: 0.010s | SAM耗时: 0.000s | 剩余时间: 10.1分钟 | 最新输出: output_frames1/frame_0100.png
[2025-05-17 17:05:15] 进度: 103/765 (13.5%) | FPS: 1.10 | 耗时/帧: 0.912s | YOLO耗时: 0.010s | SAM耗时: 0.000s | 剩余时间: 10.1分钟 | 最新输出: output_frames1/frame_0102.png
[2025-05-17 17:05:16] TinySAM预测失败: unsupported format string passed to Tensor.__format__
[2025-05-17 17:05:17] 进度: 105/765 (13.7%) | FPS: 1.09 | 耗时/帧: 0.920s | YOLO耗时: 0.011s | SAM耗时: 0.566s | 剩余时间: 10.1分钟 | 最新输出: output_frames1/frame_0104.png
[2025-05-17 17:05:19] 进度: 107/765 (14.0%) | FPS: 1.09 | 耗时/帧: 0.919s | YOLO耗时: 0.010s | SAM耗时: 0.000s | 剩余时间: 10.1分钟 | 最新输出: output_frames1/frame_0106.png
[2025-05-17 17:05:21] 进度: 109/765 (14.2%) | FPS: 1.09 | 耗时/帧: 0.918s | YOLO耗时: 0.010s | SAM耗时: 0.000s | 剩余时间: 10.0分钟 | 最新输出: output_frames1/frame_0108.png
[2025-05-17 17:05:23] 进度: 111/765 (14.5%) | FPS: 1.09 | 耗时/帧: 0.918s | YOLO耗时: 0.010s | SAM耗时: 0.000s | 剩余时间: 10.0分钟 | 最新输出: output_frames1/frame_0110.png
[2025-05-17 17:05:25] 进度: 113/765 (14.8%) | FPS: 1.09 | 耗时/帧: 0.917s | YOLO耗时: 0.010s | SAM耗时: 0.000s | 剩余时间: 10.0分钟 | 最新输出: output_frames1/frame_0112.png
[2025-05-17 17:05:26] 进度: 115/765 (15.0%) | FPS: 1.09 | 耗时/帧: 0.916s | YOLO耗时: 0.010s | SAM耗时: 0.000s | 剩余时间: 9.9分钟 | 最新输出: output_frames1/frame_0114.png
[2025-05-17 17:05:28] 进度: 117/765 (15.3%) | FPS: 1.09 | 耗时/帧: 0.915s | YOLO耗时: 0.010s | SAM耗时: 0.000s | 剩余时间: 9.9分钟 | 最新输出: output_frames1/frame_0116.png
[2025-05-17 17:05:30] 进度: 119/765 (15.6%) | FPS: 1.09 | 耗时/帧: 0.915s | YOLO耗时: 0.010s | SAM耗时: 0.000s | 剩余时间: 9.8分钟 | 最新输出: output_frames1/frame_0118.png
[2025-05-17 17:05:32] 进度: 121/765 (15.8%) | FPS: 1.09 | 耗时/帧: 0.915s | YOLO耗时: 0.010s | SAM耗时: 0.000s | 剩余时间: 9.8分钟 | 最新输出: output_frames1/frame_0120.png
[2025-05-17 17:05:33] 进度: 123/765 (16.1%) | FPS: 1.09 | 耗时/帧: 0.914s | YOLO耗时: 0.010s | SAM耗时: 0.000s | 剩余时间: 9.8分钟 | 最新输出: output_frames1/frame_0122.png
[2025-05-17 17:05:35] 进度: 125/765 (16.3%) | FPS: 1.10 | 耗时/帧: 0.913s | YOLO耗时: 0.010s | SAM耗时: 0.000s | 剩余时间: 9.7分钟 | 最新输出: output_frames1/frame_0124.png
[2025-05-17 17:05:37] 进度: 127/765 (16.6%) | FPS: 1.10 | 耗时/帧: 0.912s | YOLO耗时: 0.010s | SAM耗时: 0.000s | 剩余时间: 9.7分钟 | 最新输出: output_frames1/frame_0126.png
[2025-05-17 17:05:39] 进度: 129/765 (16.9%) | FPS: 1.10 | 耗时/帧: 0.912s | YOLO耗时: 0.010s | SAM耗时: 0.000s | 剩余时间: 9.7分钟 | 最新输出: output_frames1/frame_0128.png
[2025-05-17 17:13:10] 正在初始化增强版模型...
[2025-05-17 17:13:14] YOLOv8s-seg模型加载成功
[2025-05-17 17:13:18] TinySAM模型加载成功
[2025-05-17 17:13:18] 开始处理视频: test1.mp4
[2025-05-17 17:13:20] 进度: 1/181 (0.6%) | FPS: 0.64 | 耗时/帧: 1.571s | YOLO耗时: 1.041s | SAM耗时: 0.000s | 剩余时间: 4.7分钟 | 最新输出: enhanced_output/frame_0000.png
[2025-05-17 17:13:21] 进度: 4/181 (2.2%) | FPS: 1.51 | 耗时/帧: 0.661s | YOLO耗时: 0.012s | SAM耗时: 0.000s | 剩余时间: 2.0分钟 | 最新输出: enhanced_output/frame_0003.png
[2025-05-17 17:13:22] 进度: 7/181 (3.9%) | FPS: 1.89 | 耗时/帧: 0.530s | YOLO耗时: 0.011s | SAM耗时: 0.000s | 剩余时间: 1.5分钟 | 最新输出: enhanced_output/frame_0006.png
[2025-05-17 17:13:23] 进度: 10/181 (5.5%) | FPS: 2.09 | 耗时/帧: 0.479s | YOLO耗时: 0.011s | SAM耗时: 0.000s | 剩余时间: 1.4分钟 | 最新输出: enhanced_output/frame_0009.png
[2025-05-17 17:13:25] TinySAM预测失败: unsupported format string passed to Tensor.__format__
[2025-05-17 17:13:25] 进度: 13/181 (7.2%) | FPS: 1.93 | 耗时/帧: 0.519s | YOLO耗时: 0.013s | SAM耗时: 0.600s | 剩余时间: 1.5分钟 | 最新输出: enhanced_output/frame_0012.png
[2025-05-17 17:13:26] 进度: 16/181 (8.8%) | FPS: 2.04 | 耗时/帧: 0.489s | YOLO耗时: 0.011s | SAM耗时: 0.000s | 剩余时间: 1.3分钟 | 最新输出: enhanced_output/frame_0015.png
[2025-05-17 17:13:27] 进度: 19/181 (10.5%) | FPS: 2.13 | 耗时/帧: 0.470s | YOLO耗时: 0.011s | SAM耗时: 0.000s | 剩余时间: 1.3分钟 | 最新输出: enhanced_output/frame_0018.png
[2025-05-17 17:13:28] 进度: 22/181 (12.2%) | FPS: 2.17 | 耗时/帧: 0.460s | YOLO耗时: 0.011s | SAM耗时: 0.000s | 剩余时间: 1.2分钟 | 最新输出: enhanced_output/frame_0021.png
[2025-05-17 17:13:30] 进度: 25/181 (13.8%) | FPS: 2.23 | 耗时/帧: 0.449s | YOLO耗时: 0.011s | SAM耗时: 0.000s | 剩余时间: 1.2分钟 | 最新输出: enhanced_output/frame_0024.png
[2025-05-17 17:13:31] 进度: 28/181 (15.5%) | FPS: 2.28 | 耗时/帧: 0.439s | YOLO耗时: 0.011s | SAM耗时: 0.000s | 剩余时间: 1.1分钟 | 最新输出: enhanced_output/frame_0027.png
[2025-05-17 17:13:32] 进度: 31/181 (17.1%) | FPS: 2.32 | 耗时/帧: 0.431s | YOLO耗时: 0.011s | SAM耗时: 0.000s | 剩余时间: 1.1分钟 | 最新输出: enhanced_output/frame_0030.png
[2025-05-17 17:13:33] 进度: 34/181 (18.8%) | FPS: 2.35 | 耗时/帧: 0.426s | YOLO耗时: 0.011s | SAM耗时: 0.000s | 剩余时间: 1.0分钟 | 最新输出: enhanced_output/frame_0033.png
[2025-05-17 17:13:34] 进度: 37/181 (20.4%) | FPS: 2.38 | 耗时/帧: 0.420s | YOLO耗时: 0.011s | SAM耗时: 0.000s | 剩余时间: 1.0分钟 | 最新输出: enhanced_output/frame_0036.png
[2025-05-17 17:13:35] 进度: 40/181 (22.1%) | FPS: 2.41 | 耗时/帧: 0.415s | YOLO耗时: 0.011s | SAM耗时: 0.000s | 剩余时间: 1.0分钟 | 最新输出: enhanced_output/frame_0039.png
[2025-05-17 17:13:36] 进度: 43/181 (23.8%) | FPS: 2.44 | 耗时/帧: 0.410s | YOLO耗时: 0.011s | SAM耗时: 0.000s | 剩余时间: 0.9分钟 | 最新输出: enhanced_output/frame_0042.png
[2025-05-17 17:13:37] 进度: 46/181 (25.4%) | FPS: 2.45 | 耗时/帧: 0.409s | YOLO耗时: 0.011s | SAM耗时: 0.000s | 剩余时间: 0.9分钟 | 最新输出: enhanced_output/frame_0045.png
[2025-05-17 17:13:38] 进度: 49/181 (27.1%) | FPS: 2.46 | 耗时/帧: 0.407s | YOLO耗时: 0.011s | SAM耗时: 0.000s | 剩余时间: 0.9分钟 | 最新输出: enhanced_output/frame_0048.png
[2025-05-17 17:13:39] 进度: 52/181 (28.7%) | FPS: 2.47 | 耗时/帧: 0.405s | YOLO耗时: 0.011s | SAM耗时: 0.000s | 剩余时间: 0.9分钟 | 最新输出: enhanced_output/frame_0051.png
[2025-05-17 17:13:41] 进度: 55/181 (30.4%) | FPS: 2.48 | 耗时/帧: 0.404s | YOLO耗时: 0.011s | SAM耗时: 0.000s | 剩余时间: 0.8分钟 | 最新输出: enhanced_output/frame_0054.png
[2025-05-17 17:13:42] 进度: 58/181 (32.0%) | FPS: 2.49 | 耗时/帧: 0.401s | YOLO耗时: 0.011s | SAM耗时: 0.000s | 剩余时间: 0.8分钟 | 最新输出: enhanced_output/frame_0057.png
[2025-05-17 17:13:43] 进度: 61/181 (33.7%) | FPS: 2.51 | 耗时/帧: 0.398s | YOLO耗时: 0.011s | SAM耗时: 0.000s | 剩余时间: 0.8分钟 | 最新输出: enhanced_output/frame_0060.png
[2025-05-17 17:13:44] TinySAM预测失败: unsupported format string passed to Tensor.__format__
[2025-05-17 17:13:45] 进度: 64/181 (35.4%) | FPS: 2.42 | 耗时/帧: 0.413s | YOLO耗时: 0.012s | SAM耗时: 0.622s | 剩余时间: 0.8分钟 | 最新输出: enhanced_output/frame_0063.png
[2025-05-17 17:13:46] TinySAM预测失败: unsupported format string passed to Tensor.__format__
[2025-05-17 17:13:47] 进度: 67/181 (37.0%) | FPS: 2.36 | 耗时/帧: 0.423s | YOLO耗时: 0.012s | SAM耗时: 0.586s | 剩余时间: 0.8分钟 | 最新输出: enhanced_output/frame_0066.png
[2025-05-17 17:13:47] TinySAM预测失败: unsupported format string passed to Tensor.__format__
[2025-05-17 17:13:48] 进度: 68/181 (37.6%) | FPS: 2.29 | 耗时/帧: 0.436s | YOLO耗时: 0.012s | SAM耗时: 0.610s | 剩余时间: 0.8分钟 | 最新输出: enhanced_output/frame_0067.png
[2025-05-17 17:13:49] TinySAM预测失败: unsupported format string passed to Tensor.__format__
[2025-05-17 17:13:49] 进度: 69/181 (38.1%) | FPS: 2.24 | 耗时/帧: 0.447s | YOLO耗时: 0.012s | SAM耗时: 0.661s | 剩余时间: 0.8分钟 | 最新输出: enhanced_output/frame_0068.png
[2025-05-17 17:13:50] 进度: 72/181 (39.8%) | FPS: 2.25 | 耗时/帧: 0.444s | YOLO耗时: 0.011s | SAM耗时: 0.000s | 剩余时间: 0.8分钟 | 最新输出: enhanced_output/frame_0071.png
[2025-05-17 17:13:51] 进度: 75/181 (41.4%) | FPS: 2.27 | 耗时/帧: 0.441s | YOLO耗时: 0.011s | SAM耗时: 0.000s | 剩余时间: 0.8分钟 | 最新输出: enhanced_output/frame_0074.png
[2025-05-17 17:13:52] 进度: 78/181 (43.1%) | FPS: 2.29 | 耗时/帧: 0.437s | YOLO耗时: 0.011s | SAM耗时: 0.000s | 剩余时间: 0.8分钟 | 最新输出: enhanced_output/frame_0077.png
[2025-05-17 17:13:54] TinySAM预测失败: unsupported format string passed to Tensor.__format__
[2025-05-17 17:13:54] 进度: 80/181 (44.2%) | FPS: 2.24 | 耗时/帧: 0.446s | YOLO耗时: 0.012s | SAM耗时: 0.693s | 剩余时间: 0.8分钟 | 最新输出: enhanced_output/frame_0079.png
[2025-05-17 17:13:55] 进度: 83/181 (45.9%) | FPS: 2.25 | 耗时/帧: 0.444s | YOLO耗时: 0.011s | SAM耗时: 0.000s | 剩余时间: 0.7分钟 | 最新输出: enhanced_output/frame_0082.png
[2025-05-17 17:13:56] 进度: 86/181 (47.5%) | FPS: 2.27 | 耗时/帧: 0.440s | YOLO耗时: 0.011s | SAM耗时: 0.000s | 剩余时间: 0.7分钟 | 最新输出: enhanced_output/frame_0085.png
[2025-05-17 17:13:58] TinySAM预测失败: unsupported format string passed to Tensor.__format__
[2025-05-17 17:13:58] 进度: 89/181 (49.2%) | FPS: 2.24 | 耗时/帧: 0.446s | YOLO耗时: 0.012s | SAM耗时: 0.596s | 剩余时间: 0.7分钟 | 最新输出: enhanced_output/frame_0088.png
[2025-05-17 17:13:59] TinySAM预测失败: unsupported format string passed to Tensor.__format__
[2025-05-17 17:13:59] 进度: 90/181 (49.7%) | FPS: 2.20 | 耗时/帧: 0.455s | YOLO耗时: 0.012s | SAM耗时: 0.587s | 剩余时间: 0.7分钟 | 最新输出: enhanced_output/frame_0089.png
[2025-05-17 17:14:00] TinySAM预测失败: unsupported format string passed to Tensor.__format__
[2025-05-17 17:14:00] 进度: 91/181 (50.3%) | FPS: 2.16 | 耗时/帧: 0.463s | YOLO耗时: 0.012s | SAM耗时: 0.620s | 剩余时间: 0.7分钟 | 最新输出: enhanced_output/frame_0090.png
[2025-05-17 17:14:01] 进度: 94/181 (51.9%) | FPS: 2.18 | 耗时/帧: 0.459s | YOLO耗时: 0.011s | SAM耗时: 0.000s | 剩余时间: 0.7分钟 | 最新输出: enhanced_output/frame_0093.png
[2025-05-17 17:14:03] 进度: 97/181 (53.6%) | FPS: 2.19 | 耗时/帧: 0.456s | YOLO耗时: 0.011s | SAM耗时: 0.000s | 剩余时间: 0.6分钟 | 最新输出: enhanced_output/frame_0096.png
[2025-05-17 17:14:04] 进度: 100/181 (55.2%) | FPS: 2.20 | 耗时/帧: 0.454s | YOLO耗时: 0.011s | SAM耗时: 0.000s | 剩余时间: 0.6分钟 | 最新输出: enhanced_output/frame_0099.png
[2025-05-17 17:14:05] 进度: 103/181 (56.9%) | FPS: 2.22 | 耗时/帧: 0.451s | YOLO耗时: 0.011s | SAM耗时: 0.000s | 剩余时间: 0.6分钟 | 最新输出: enhanced_output/frame_0102.png
[2025-05-17 17:14:06] 进度: 106/181 (58.6%) | FPS: 2.23 | 耗时/帧: 0.448s | YOLO耗时: 0.011s | SAM耗时: 0.000s | 剩余时间: 0.6分钟 | 最新输出: enhanced_output/frame_0105.png
[2025-05-17 17:14:07] 进度: 109/181 (60.2%) | FPS: 2.25 | 耗时/帧: 0.445s | YOLO耗时: 0.011s | SAM耗时: 0.000s | 剩余时间: 0.5分钟 | 最新输出: enhanced_output/frame_0108.png
[2025-05-17 17:14:08] 进度: 112/181 (61.9%) | FPS: 2.25 | 耗时/帧: 0.444s | YOLO耗时: 0.011s | SAM耗时: 0.000s | 剩余时间: 0.5分钟 | 最新输出: enhanced_output/frame_0111.png
[2025-05-17 17:14:09] TinySAM预测失败: unsupported format string passed to Tensor.__format__
[2025-05-17 17:14:10] 进度: 114/181 (63.0%) | FPS: 2.23 | 耗时/帧: 0.449s | YOLO耗时: 0.012s | SAM耗时: 0.622s | 剩余时间: 0.5分钟 | 最新输出: enhanced_output/frame_0113.png
[2025-05-17 17:14:11] TinySAM预测失败: unsupported format string passed to Tensor.__format__
[2025-05-17 17:14:11] 进度: 116/181 (64.1%) | FPS: 2.19 | 耗时/帧: 0.457s | YOLO耗时: 0.012s | SAM耗时: 0.699s | 剩余时间: 0.5分钟 | 最新输出: enhanced_output/frame_0115.png
[2025-05-17 17:14:12] 进度: 119/181 (65.7%) | FPS: 2.20 | 耗时/帧: 0.455s | YOLO耗时: 0.011s | SAM耗时: 0.000s | 剩余时间: 0.5分钟 | 最新输出: enhanced_output/frame_0118.png
[2025-05-17 17:14:13] 进度: 122/181 (67.4%) | FPS: 2.21 | 耗时/帧: 0.452s | YOLO耗时: 0.011s | SAM耗时: 0.000s | 剩余时间: 0.4分钟 | 最新输出: enhanced_output/frame_0121.png
[2025-05-17 17:14:14] TinySAM预测失败: unsupported format string passed to Tensor.__format__
[2025-05-17 17:14:15] 进度: 123/181 (68.0%) | FPS: 2.19 | 耗时/帧: 0.458s | YOLO耗时: 0.012s | SAM耗时: 0.578s | 剩余时间: 0.4分钟 | 最新输出: enhanced_output/frame_0122.png
[2025-05-17 17:14:16] 进度: 126/181 (69.6%) | FPS: 2.20 | 耗时/帧: 0.455s | YOLO耗时: 0.011s | SAM耗时: 0.000s | 剩余时间: 0.4分钟 | 最新输出: enhanced_output/frame_0125.png
[2025-05-17 17:14:17] 进度: 129/181 (71.3%) | FPS: 2.21 | 耗时/帧: 0.453s | YOLO耗时: 0.011s | SAM耗时: 0.000s | 剩余时间: 0.4分钟 | 最新输出: enhanced_output/frame_0128.png
[2025-05-17 17:14:18] 进度: 132/181 (72.9%) | FPS: 2.22 | 耗时/帧: 0.451s | YOLO耗时: 0.011s | SAM耗时: 0.000s | 剩余时间: 0.4分钟 | 最新输出: enhanced_output/frame_0131.png
[2025-05-17 17:14:19] 进度: 135/181 (74.6%) | FPS: 2.23 | 耗时/帧: 0.449s | YOLO耗时: 0.011s | SAM耗时: 0.000s | 剩余时间: 0.3分钟 | 最新输出: enhanced_output/frame_0134.png
[2025-05-17 17:14:20] TinySAM预测失败: unsupported format string passed to Tensor.__format__
[2025-05-17 17:14:21] 进度: 138/181 (76.2%) | FPS: 2.21 | 耗时/帧: 0.453s | YOLO耗时: 0.015s | SAM耗时: 0.646s | 剩余时间: 0.3分钟 | 最新输出: enhanced_output/frame_0137.png
[2025-05-17 17:14:22] 进度: 141/181 (77.9%) | FPS: 2.22 | 耗时/帧: 0.451s | YOLO耗时: 0.011s | SAM耗时: 0.000s | 剩余时间: 0.3分钟 | 最新输出: enhanced_output/frame_0140.png
[2025-05-17 17:14:23] 进度: 144/181 (79.6%) | FPS: 2.23 | 耗时/帧: 0.449s | YOLO耗时: 0.011s | SAM耗时: 0.000s | 剩余时间: 0.3分钟 | 最新输出: enhanced_output/frame_0143.png
[2025-05-17 17:14:24] 进度: 147/181 (81.2%) | FPS: 2.24 | 耗时/帧: 0.447s | YOLO耗时: 0.011s | SAM耗时: 0.000s | 剩余时间: 0.3分钟 | 最新输出: enhanced_output/frame_0146.png
[2025-05-17 17:14:25] 进度: 150/181 (82.9%) | FPS: 2.24 | 耗时/帧: 0.446s | YOLO耗时: 0.011s | SAM耗时: 0.000s | 剩余时间: 0.2分钟 | 最新输出: enhanced_output/frame_0149.png
[2025-05-17 17:14:26] 进度: 153/181 (84.5%) | FPS: 2.25 | 耗时/帧: 0.444s | YOLO耗时: 0.011s | SAM耗时: 0.000s | 剩余时间: 0.2分钟 | 最新输出: enhanced_output/frame_0152.png
[2025-05-17 17:14:27] 进度: 156/181 (86.2%) | FPS: 2.26 | 耗时/帧: 0.442s | YOLO耗时: 0.011s | SAM耗时: 0.000s | 剩余时间: 0.2分钟 | 最新输出: enhanced_output/frame_0155.png
[2025-07-04 18:10:01] 正在初始化增强版模型...
[2025-07-04 18:10:01] YOLOv8s-seg模型加载成功
[2025-07-04 18:10:05] TinySAM模型加载成功
[2025-07-04 18:10:05] 开始处理视频: test1.mp4
[2025-07-04 18:10:07] 进度: 1/181 (0.6%) | FPS: 0.60 | 耗时/帧: 1.655s | YOLO耗时: 1.092s | SAM耗时: 0.000s | 剩余时间: 5.0分钟 | 最新输出: enhanced_output/frame_0000.png
[2025-07-04 18:10:08] 进度: 4/181 (2.2%) | FPS: 1.50 | 耗时/帧: 0.669s | YOLO耗时: 0.013s | SAM耗时: 0.000s | 剩余时间: 2.0分钟 | 最新输出: enhanced_output/frame_0003.png
[2025-07-04 18:10:09] 进度: 7/181 (3.9%) | FPS: 1.90 | 耗时/帧: 0.527s | YOLO耗时: 0.013s | SAM耗时: 0.000s | 剩余时间: 1.5分钟 | 最新输出: enhanced_output/frame_0006.png
[2025-07-04 18:10:10] 进度: 10/181 (5.5%) | FPS: 2.08 | 耗时/帧: 0.480s | YOLO耗时: 0.013s | SAM耗时: 0.000s | 剩余时间: 1.4分钟 | 最新输出: enhanced_output/frame_0009.png
[2025-07-04 18:10:15] TinySAM预测失败: unsupported format string passed to Tensor.__format__
[2025-07-04 18:10:15] 进度: 13/181 (7.2%) | FPS: 1.32 | 耗时/帧: 0.759s | YOLO耗时: 0.015s | SAM耗时: 3.894s | 剩余时间: 2.1分钟 | 最新输出: enhanced_output/frame_0012.png
[2025-07-04 18:10:16] 进度: 16/181 (8.8%) | FPS: 1.47 | 耗时/帧: 0.680s | YOLO耗时: 0.011s | SAM耗时: 0.000s | 剩余时间: 1.9分钟 | 最新输出: enhanced_output/frame_0015.png
[2025-07-04 18:10:17] 进度: 19/181 (10.5%) | FPS: 1.58 | 耗时/帧: 0.632s | YOLO耗时: 0.011s | SAM耗时: 0.000s | 剩余时间: 1.7分钟 | 最新输出: enhanced_output/frame_0018.png
[2025-07-04 18:10:18] 进度: 22/181 (12.2%) | FPS: 1.69 | 耗时/帧: 0.593s | YOLO耗时: 0.011s | SAM耗时: 0.000s | 剩余时间: 1.6分钟 | 最新输出: enhanced_output/frame_0021.png
[2025-07-04 18:10:19] 进度: 25/181 (13.8%) | FPS: 1.77 | 耗时/帧: 0.563s | YOLO耗时: 0.011s | SAM耗时: 0.000s | 剩余时间: 1.5分钟 | 最新输出: enhanced_output/frame_0024.png
[2025-07-04 18:10:20] 进度: 28/181 (15.5%) | FPS: 1.86 | 耗时/帧: 0.539s | YOLO耗时: 0.011s | SAM耗时: 0.000s | 剩余时间: 1.4分钟 | 最新输出: enhanced_output/frame_0027.png
[2025-07-04 18:10:22] 进度: 31/181 (17.1%) | FPS: 1.92 | 耗时/帧: 0.521s | YOLO耗时: 0.011s | SAM耗时: 0.000s | 剩余时间: 1.3分钟 | 最新输出: enhanced_output/frame_0030.png
[2025-07-04 18:10:23] 进度: 35/181 (19.3%) | FPS: 2.00 | 耗时/帧: 0.499s | YOLO耗时: 0.011s | SAM耗时: 0.000s | 剩余时间: 1.2分钟 | 最新输出: enhanced_output/frame_0034.png
[2025-07-04 18:10:24] 进度: 38/181 (21.0%) | FPS: 2.05 | 耗时/帧: 0.487s | YOLO耗时: 0.011s | SAM耗时: 0.000s | 剩余时间: 1.2分钟 | 最新输出: enhanced_output/frame_0037.png
[2025-07-04 18:10:25] 进度: 42/181 (23.2%) | FPS: 2.12 | 耗时/帧: 0.472s | YOLO耗时: 0.011s | SAM耗时: 0.000s | 剩余时间: 1.1分钟 | 最新输出: enhanced_output/frame_0041.png
[2025-07-04 18:10:27] 进度: 46/181 (25.4%) | FPS: 2.17 | 耗时/帧: 0.460s | YOLO耗时: 0.011s | SAM耗时: 0.000s | 剩余时间: 1.0分钟 | 最新输出: enhanced_output/frame_0045.png
[2025-07-04 18:10:28] 进度: 49/181 (27.1%) | FPS: 2.20 | 耗时/帧: 0.455s | YOLO耗时: 0.011s | SAM耗时: 0.000s | 剩余时间: 1.0分钟 | 最新输出: enhanced_output/frame_0048.png
[2025-07-04 18:10:29] 进度: 52/181 (28.7%) | FPS: 2.23 | 耗时/帧: 0.449s | YOLO耗时: 0.011s | SAM耗时: 0.000s | 剩余时间: 1.0分钟 | 最新输出: enhanced_output/frame_0051.png
[2025-07-04 18:10:30] 进度: 55/181 (30.4%) | FPS: 2.26 | 耗时/帧: 0.443s | YOLO耗时: 0.011s | SAM耗时: 0.000s | 剩余时间: 0.9分钟 | 最新输出: enhanced_output/frame_0054.png
[2025-07-04 18:10:31] 进度: 58/181 (32.0%) | FPS: 2.28 | 耗时/帧: 0.438s | YOLO耗时: 0.011s | SAM耗时: 0.000s | 剩余时间: 0.9分钟 | 最新输出: enhanced_output/frame_0057.png
[2025-07-04 18:10:32] 进度: 62/181 (34.3%) | FPS: 2.32 | 耗时/帧: 0.431s | YOLO耗时: 0.011s | SAM耗时: 0.000s | 剩余时间: 0.9分钟 | 最新输出: enhanced_output/frame_0061.png
[2025-07-04 18:10:36] TinySAM预测失败: unsupported format string passed to Tensor.__format__
[2025-07-04 18:10:37] 进度: 64/181 (35.4%) | FPS: 2.05 | 耗时/帧: 0.489s | YOLO耗时: 0.012s | SAM耗时: 3.736s | 剩余时间: 1.0分钟 | 最新输出: enhanced_output/frame_0063.png
[2025-07-04 18:10:41] TinySAM预测失败: unsupported format string passed to Tensor.__format__
[2025-07-04 18:10:42] 进度: 67/181 (37.0%) | FPS: 1.84 | 耗时/帧: 0.543s | YOLO耗时: 0.012s | SAM耗时: 3.755s | 剩余时间: 1.0分钟 | 最新输出: enhanced_output/frame_0066.png
[2025-07-04 18:10:46] TinySAM预测失败: unsupported format string passed to Tensor.__format__
[2025-07-04 18:10:46] 进度: 68/181 (37.6%) | FPS: 1.67 | 耗时/帧: 0.598s | YOLO耗时: 0.012s | SAM耗时: 3.730s | 剩余时间: 1.1分钟 | 最新输出: enhanced_output/frame_0067.png
[2025-07-04 18:10:50] TinySAM预测失败: unsupported format string passed to Tensor.__format__
[2025-07-04 18:10:50] 进度: 69/181 (38.1%) | FPS: 1.54 | 耗时/帧: 0.651s | YOLO耗时: 0.013s | SAM耗时: 3.776s | 剩余时间: 1.2分钟 | 最新输出: enhanced_output/frame_0068.png
[2025-07-04 18:10:51] 进度: 72/181 (39.8%) | FPS: 1.57 | 耗时/帧: 0.639s | YOLO耗时: 0.011s | SAM耗时: 0.000s | 剩余时间: 1.2分钟 | 最新输出: enhanced_output/frame_0071.png
[2025-07-04 18:10:52] 进度: 75/181 (41.4%) | FPS: 1.60 | 耗时/帧: 0.627s | YOLO耗时: 0.011s | SAM耗时: 0.000s | 剩余时间: 1.1分钟 | 最新输出: enhanced_output/frame_0074.png
[2025-07-04 18:10:54] 进度: 79/181 (43.6%) | FPS: 1.63 | 耗时/帧: 0.612s | YOLO耗时: 0.011s | SAM耗时: 0.000s | 剩余时间: 1.0分钟 | 最新输出: enhanced_output/frame_0078.png
[2025-07-04 18:10:58] TinySAM预测失败: unsupported format string passed to Tensor.__format__
[2025-07-04 18:10:58] 进度: 80/181 (44.2%) | FPS: 1.52 | 耗时/帧: 0.660s | YOLO耗时: 0.012s | SAM耗时: 3.981s | 剩余时间: 1.1分钟 | 最新输出: enhanced_output/frame_0079.png
[2025-07-04 18:10:59] 进度: 83/181 (45.9%) | FPS: 1.54 | 耗时/帧: 0.649s | YOLO耗时: 0.011s | SAM耗时: 0.000s | 剩余时间: 1.1分钟 | 最新输出: enhanced_output/frame_0082.png
[2025-07-04 18:11:01] 进度: 87/181 (48.1%) | FPS: 1.58 | 耗时/帧: 0.635s | YOLO耗时: 0.011s | SAM耗时: 0.000s | 剩余时间: 1.0分钟 | 最新输出: enhanced_output/frame_0086.png
[2025-07-04 18:11:05] TinySAM预测失败: unsupported format string passed to Tensor.__format__
[2025-07-04 18:11:05] 进度: 89/181 (49.2%) | FPS: 1.49 | 耗时/帧: 0.671s | YOLO耗时: 0.012s | SAM耗时: 3.663s | 剩余时间: 1.0分钟 | 最新输出: enhanced_output/frame_0088.png
[2025-07-04 18:11:09] TinySAM预测失败: unsupported format string passed to Tensor.__format__
[2025-07-04 18:11:09] 进度: 90/181 (49.7%) | FPS: 1.41 | 耗时/帧: 0.709s | YOLO耗时: 0.012s | SAM耗时: 3.575s | 剩余时间: 1.1分钟 | 最新输出: enhanced_output/frame_0089.png
[2025-07-04 18:11:13] TinySAM预测失败: unsupported format string passed to Tensor.__format__
[2025-07-04 18:11:13] 进度: 91/181 (50.3%) | FPS: 1.34 | 耗时/帧: 0.748s | YOLO耗时: 0.014s | SAM耗时: 3.708s | 剩余时间: 1.1分钟 | 最新输出: enhanced_output/frame_0090.png
[2025-07-04 18:11:15] 进度: 95/181 (52.5%) | FPS: 1.37 | 耗时/帧: 0.730s | YOLO耗时: 0.011s | SAM耗时: 0.000s | 剩余时间: 1.0分钟 | 最新输出: enhanced_output/frame_0094.png
[2025-07-04 18:11:16] 进度: 99/181 (54.7%) | FPS: 1.40 | 耗时/帧: 0.714s | YOLO耗时: 0.011s | SAM耗时: 0.000s | 剩余时间: 1.0分钟 | 最新输出: enhanced_output/frame_0098.png
[2025-07-04 18:11:17] 进度: 102/181 (56.4%) | FPS: 1.42 | 耗时/帧: 0.703s | YOLO耗时: 0.011s | SAM耗时: 0.000s | 剩余时间: 0.9分钟 | 最新输出: enhanced_output/frame_0101.png
[2025-07-04 18:11:18] 进度: 106/181 (58.6%) | FPS: 1.45 | 耗时/帧: 0.689s | YOLO耗时: 0.011s | SAM耗时: 0.000s | 剩余时间: 0.9分钟 | 最新输出: enhanced_output/frame_0105.png
[2025-07-04 18:11:20] 进度: 109/181 (60.2%) | FPS: 1.47 | 耗时/帧: 0.680s | YOLO耗时: 0.011s | SAM耗时: 0.000s | 剩余时间: 0.8分钟 | 最新输出: enhanced_output/frame_0108.png
[2025-07-04 18:11:21] 进度: 113/181 (62.4%) | FPS: 1.50 | 耗时/帧: 0.668s | YOLO耗时: 0.011s | SAM耗时: 0.000s | 剩余时间: 0.8分钟 | 最新输出: enhanced_output/frame_0112.png
[2025-07-04 18:11:25] TinySAM预测失败: unsupported format string passed to Tensor.__format__
[2025-07-04 18:11:25] 进度: 114/181 (63.0%) | FPS: 1.43 | 耗时/帧: 0.699s | YOLO耗时: 0.012s | SAM耗时: 3.729s | 剩余时间: 0.8分钟 | 最新输出: enhanced_output/frame_0113.png
[2025-07-04 18:11:30] TinySAM预测失败: unsupported format string passed to Tensor.__format__
[2025-07-04 18:11:30] 进度: 116/181 (64.1%) | FPS: 1.37 | 耗时/帧: 0.731s | YOLO耗时: 0.012s | SAM耗时: 4.098s | 剩余时间: 0.8分钟 | 最新输出: enhanced_output/frame_0115.png
[2025-07-04 18:11:31] 进度: 120/181 (66.3%) | FPS: 1.39 | 耗时/帧: 0.718s | YOLO耗时: 0.011s | SAM耗时: 0.000s | 剩余时间: 0.7分钟 | 最新输出: enhanced_output/frame_0119.png
[2025-07-04 18:11:36] TinySAM预测失败: unsupported format string passed to Tensor.__format__
[2025-07-04 18:11:37] 进度: 123/181 (68.0%) | FPS: 1.35 | 耗时/帧: 0.741s | YOLO耗时: 0.012s | SAM耗时: 3.894s | 剩余时间: 0.7分钟 | 最新输出: enhanced_output/frame_0122.png
[2025-07-04 18:11:38] 进度: 126/181 (69.6%) | FPS: 1.37 | 耗时/帧: 0.732s | YOLO耗时: 0.011s | SAM耗时: 0.000s | 剩余时间: 0.7分钟 | 最新输出: enhanced_output/frame_0125.png
[2025-07-04 18:11:39] 进度: 130/181 (71.8%) | FPS: 1.39 | 耗时/帧: 0.720s | YOLO耗时: 0.011s | SAM耗时: 0.000s | 剩余时间: 0.6分钟 | 最新输出: enhanced_output/frame_0129.png
[2025-07-04 18:11:40] 进度: 133/181 (73.5%) | FPS: 1.41 | 耗时/帧: 0.711s | YOLO耗时: 0.011s | SAM耗时: 0.000s | 剩余时间: 0.6分钟 | 最新输出: enhanced_output/frame_0132.png
[2025-07-04 18:11:41] 进度: 136/181 (75.1%) | FPS: 1.42 | 耗时/帧: 0.703s | YOLO耗时: 0.011s | SAM耗时: 0.000s | 剩余时间: 0.5分钟 | 最新输出: enhanced_output/frame_0135.png
[2025-07-04 18:11:45] TinySAM预测失败: unsupported format string passed to Tensor.__format__
[2025-07-04 18:11:45] 进度: 138/181 (76.2%) | FPS: 1.38 | 耗时/帧: 0.725s | YOLO耗时: 0.012s | SAM耗时: 3.579s | 剩余时间: 0.5分钟 | 最新输出: enhanced_output/frame_0137.png
[2025-07-04 18:11:46] 进度: 141/181 (77.9%) | FPS: 1.39 | 耗时/帧: 0.717s | YOLO耗时: 0.011s | SAM耗时: 0.000s | 剩余时间: 0.5分钟 | 最新输出: enhanced_output/frame_0140.png
[2025-07-04 18:11:48] 进度: 144/181 (79.6%) | FPS: 1.41 | 耗时/帧: 0.709s | YOLO耗时: 0.012s | SAM耗时: 0.000s | 剩余时间: 0.4分钟 | 最新输出: enhanced_output/frame_0143.png
[2025-07-04 18:11:49] 进度: 147/181 (81.2%) | FPS: 1.42 | 耗时/帧: 0.702s | YOLO耗时: 0.011s | SAM耗时: 0.000s | 剩余时间: 0.4分钟 | 最新输出: enhanced_output/frame_0146.png
[2025-07-04 18:11:50] 进度: 150/181 (82.9%) | FPS: 1.44 | 耗时/帧: 0.694s | YOLO耗时: 0.011s | SAM耗时: 0.000s | 剩余时间: 0.4分钟 | 最新输出: enhanced_output/frame_0149.png
[2025-07-04 18:11:51] 进度: 153/181 (84.5%) | FPS: 1.45 | 耗时/帧: 0.687s | YOLO耗时: 0.011s | SAM耗时: 0.000s | 剩余时间: 0.3分钟 | 最新输出: enhanced_output/frame_0152.png
[2025-07-04 18:11:52] 进度: 156/181 (86.2%) | FPS: 1.47 | 耗时/帧: 0.681s | YOLO耗时: 0.011s | SAM耗时: 0.000s | 剩余时间: 0.3分钟 | 最新输出: enhanced_output/frame_0155.png
[2025-07-04 18:11:53] 进度: 159/181 (87.8%) | FPS: 1.48 | 耗时/帧: 0.675s | YOLO耗时: 0.011s | SAM耗时: 0.000s | 剩余时间: 0.2分钟 | 最新输出: enhanced_output/frame_0158.png
[2025-07-04 18:11:54] 进度: 163/181 (90.1%) | FPS: 1.50 | 耗时/帧: 0.667s | YOLO耗时: 0.011s | SAM耗时: 0.000s | 剩余时间: 0.2分钟 | 最新输出: enhanced_output/frame_0162.png
[2025-07-04 18:11:55] 进度: 167/181 (92.3%) | FPS: 1.52 | 耗时/帧: 0.659s | YOLO耗时: 0.011s | SAM耗时: 0.000s | 剩余时间: 0.2分钟 | 最新输出: enhanced_output/frame_0166.png
[2025-07-04 18:11:57] 进度: 171/181 (94.5%) | FPS: 1.54 | 耗时/帧: 0.651s | YOLO耗时: 0.011s | SAM耗时: 0.000s | 剩余时间: 0.1分钟 | 最新输出: enhanced_output/frame_0170.png
[2025-07-04 18:11:58] 进度: 174/181 (96.1%) | FPS: 1.55 | 耗时/帧: 0.646s | YOLO耗时: 0.011s | SAM耗时: 0.000s | 剩余时间: 0.1分钟 | 最新输出: enhanced_output/frame_0173.png
[2025-07-04 18:11:59] 进度: 178/181 (98.3%) | FPS: 1.57 | 耗时/帧: 0.639s | YOLO耗时: 0.011s | SAM耗时: 0.000s | 剩余时间: 0.0分钟 | 最新输出: enhanced_output/frame_0177.png
[2025-07-04 18:12:00] 进度: 181/181 (100.0%) | FPS: 1.58 | 耗时/帧: 0.634s | YOLO耗时: 0.011s | SAM耗时: 0.000s | 剩余时间: 0.0分钟 | 最新输出: enhanced_output/frame_0180.png
[2025-07-04 18:12:00] 
=== 增强版性能总结 ===
结束时间: 2025-07-04 18:12:00
视频文件: test1.mp4
总帧数: 181/181
检测参数: conf=0.3, iou=0.2
总时间: 114.81秒 (1.9分钟)
平均FPS: 1.58
平均每帧耗时: 634.33ms
输出目录: /home/huangmanling/TinySAM-main/enhanced_output

[2025-07-04 18:12:00] 增强版组织分析完成!
